{
  "$schema": "./schemas/project-profile.schema.json",
  "schema": "project-profile/v3",
  "project": {
    "name": "geppio",
    "kind": "desktop-workbench-prototype",
    "summary": "Windows-first local workbench prototype with peer regions, region-aware continuous CSS-pixel widget placement, trusted experimental local plugins and a future permissioned untrusted-plugin platform."
  },
  "owner": {
    "repository_language": "en",
    "report_language": "pt-BR"
  },
  "platforms": [
    "windows-x64"
  ],
  "languages": [
    "TypeScript",
    "CSS",
    "HTML"
  ],
  "toolchain": [
    "Node.js 24",
    "pnpm 11.25.0",
    "Electron",
    "React",
    "Tailwind CSS",
    "Heroicons",
    "Motion",
    "electron-vite",
    "TypeScript",
    "Node test runner",
    "Playwright"
  ],
  "constraints": [
    "Product name GeppIO; technical namespace geppio; Canonical GitHub repository rabrunos/GeppIO, stable repository ID 1409287329 (Issue #6).",
    "No application login, external service or paid AI API.",
    "The alpha.1 foundation used static fixtures; alpha.2 added trusted experimental local plugins (Issue #21). No native terminal or secure untrusted-plugin platform is implemented.",
    "No BootCrate Setup, Console, raw intake or upstream application code.",
    "Completed, validated approved GeppIO Issues inherit standing commit/push authorization under TASK_POLICY after repository ID/origin/main/staged-diff verification; explicit task overrides apply. Issue metadata/closure and publication require separate authority."
  ],
  "architecture_invariants": [
    "Fixed header outside widget arrangement.",
    "The prototype represents Sidebar, Main and Bottom as siblings; the owner discussion about the final abstraction remains open.",
    "Continuous CSS-pixel geometry across Main/Sidebar/Bottom; bounded default, optional content-bounded horizontal expansion, stable-source reversible projection and no viewport-only layout writes (Issue #29). Historical grid data remains preserved.",
    "Editing layout requires an explicit mode.",
    "Presentation, anchor and collapsibility remain independent concepts.",
    "A plugin is not equivalent to a widget; trusted local packages run in disposable Web Workers with declarative widgets and lifecycle limits. This experimental runtime is not secure isolation for untrusted plugins.",
    "No Node, filesystem or generic IPC exposed to the renderer."
  ],
  "validation": {
    "canonical_capabilities": [
      "doctor",
      "check:repo",
      "typecheck",
      "lint",
      "test",
      "plugins:build",
      "build",
      "dev",
      "test:desktop",
      "test:desktop:dev"
    ],
    "required_files": [
      "PROJECT_GUIDE.md",
      "AGENTS.md",
      "package.json",
      "CHANGELOG.md",
      "docs/product/requirements.md",
      "docs/architecture/security.md",
      ".codex/config.toml",
      ".codex/agents/scout.toml",
      ".codex/agents/worker.toml",
      ".github/workflows/checks.yml"
    ]
  },
  "workflow": {
    "tracking": "github_issues",
    "primary_orchestrator": "chatgpt",
    "fallback_planners": [
      "codex_plan"
    ],
    "implementation_harnesses": [
      "codex"
    ],
    "consumption_preset": "standard",
    "collaboration": "single"
  },
  "execution_permissions": {
    "safe_default": "protected_auto"
  },
  "versioning": {
    "required": true,
    "canonical_source": "package.json",
    "reader": "json",
    "value_path": "/version",
    "format": "semver",
    "history_source": "CHANGELOG.md",
    "history_format": "markdown-headings",
    "mirrors": [],
    "target_version_in_prompt_h1": true,
    "target_version_in_commit": true,
    "target_version_in_report_h1": true,
    "continuations_reuse_target": true
  },
  "security": {
    "exposure": "local",
    "data_classes": [
      "internal"
    ],
    "untrusted_inputs": [
      "Imported layout JSON",
      "Persisted layout bytes",
      "Custom protocol URLs",
      "Development URL override",
      "Local plugin manifests, installed package/state bytes and Worker messages (validated inputs; executable plugins must still be trusted)",
      "Third-party build dependencies"
    ],
    "modules": [
      "desktop-mobile"
    ],
    "control_map": "docs/architecture/security.md",
    "verification_commands": [
      "pnpm test",
      "pnpm check:repo",
      "pnpm test:desktop"
    ]
  },
  "services": [],
  "distribution": {
    "mode": "none",
    "targets": []
  },
  "console": {
    "enabled": false
  },
  "skills": [
    "context-discovery",
    "safe-validation",
    "concise-report",
    "diagnostics-analysis"
  ]
}
